{
  "$schema": "https://light-tracker.app/schemas/backup-v1.json",
  "version": "1.0.0",
  "exportedAt": "2026-09-05T18:00:00+01:00",
  "generator": "light-tracker-web/0.1.0",
  "home": {
    "id": "home_abc123",
    "name": "Alex D. Home",
    "location": "Yaba, Lagos, Nigeria",
    "timezone": "Africa/Lagos",
    "createdAt": "2026-08-20T00:00:00+01:00"
  },
  "sensors": [
    {
      "id": "sensor_a",
      "role": "GRID",
      "name": "Grid Sensor (Main Inflow)",
      "deviceId": "tuya_device_xyz",
      "online": true,
      "lastSeenAt": "2026-09-05T18:00:00+01:00"
    },
    {
      "id": "sensor_b",
      "role": "BACKUP",
      "name": "Inverter Sensor (Router Backup)",
      "deviceId": "tuya_device_abc",
      "online": true,
      "lastSeenAt": "2026-09-05T18:00:00+01:00"
    }
  ],
  "rawObservations": [
    {
      "timestamp": "2026-09-05T12:00:00+01:00",
      "sensorAOnline": false,
      "sensorBOnline": true,
      "state": "OFF",
      "reasonCode": "GRID_SENSOR_OFFLINE_BACKUP_ONLINE"
    },
    {
      "timestamp": "2026-09-05T12:05:00+01:00",
      "sensorAOnline": false,
      "sensorBOnline": true,
      "state": "OFF",
      "reasonCode": "GRID_SENSOR_OFFLINE_BACKUP_ONLINE"
    },
    {
      "timestamp": "2026-09-05T12:10:00+01:00",
      "sensorAOnline": false,
      "sensorBOnline": true,
      "state": "OFF",
      "reasonCode": "GRID_SENSOR_OFFLINE_BACKUP_ONLINE"
    },
    {
      "timestamp": "2026-09-05T12:15:00+01:00",
      "sensorAOnline": false,
      "sensorBOnline": true,
      "state": "OFF",
      "reasonCode": "GRID_SENSOR_OFFLINE_BACKUP_ONLINE"
    },
    {
      "timestamp": "2026-09-05T12:20:00+01:00",
      "sensorAOnline": false,
      "sensorBOnline": true,
      "state": "OFF",
      "reasonCode": "GRID_SENSOR_OFFLINE_BACKUP_ONLINE"
    },
    {
      "timestamp": "2026-09-05T12:25:00+01:00",
      "sensorAOnline": false,
      "sensorBOnline": true,
      "state": "OFF",
      "reasonCode": "GRID_SENSOR_OFFLINE_BACKUP_ONLINE"
    },
    {
      "timestamp": "2026-09-05T12:30:00+01:00",
      "sensorAOnline": false,
      "sensorBOnline": true,
      "state": "OFF",
      "reasonCode": "GRID_SENSOR_OFFLINE_BACKUP_ONLINE"
    },
    {
      "timestamp": "2026-09-05T12:35:00+01:00",
      "sensorAOnline": false,
      "sensorBOnline": true,
      "state": "OFF",
      "reasonCode": "GRID_SENSOR_OFFLINE_BACKUP_ONLINE"
    },
    {
      "timestamp": "2026-09-05T12:40:00+01:00",
      "sensorAOnline": false,
      "sensorBOnline": true,
      "state": "OFF",
      "reasonCode": "GRID_SENSOR_OFFLINE_BACKUP_ONLINE"
    },
    {
      "timestamp": "2026-09-05T12:45:00+01:00",
      "sensorAOnline": false,
      "sensorBOnline": true,
      "state": "OFF",
      "reasonCode": "GRID_SENSOR_OFFLINE_BACKUP_ONLINE"
    },
    {
      "timestamp": "2026-09-05T12:50:00+01:00",
      "sensorAOnline": false,
      "sensorBOnline": true,
      "state": "OFF",
      "reasonCode": "GRID_SENSOR_OFFLINE_BACKUP_ONLINE"
    },
    {
      "timestamp": "2026-09-05T12:55:00+01:00",
      "sensorAOnline": false,
      "sensorBOnline": true,
      "state": "OFF",
      "reasonCode": "GRID_SENSOR_OFFLINE_BACKUP_ONLINE"
    },
    {
      "timestamp": "2026-09-05T13:00:00+01:00",
      "sensorAOnline": false,
      "sensorBOnline": true,
      "state": "OFF",
      "reasonCode": "GRID_SENSOR_OFFLINE_BACKUP_ONLINE"
    },
    {
      "timestamp": "2026-09-05T13:05:00+01:00",
      "sensorAOnline": false,
      "sensorBOnline": true,
      "state": "OFF",
      "reasonCode": "GRID_SENSOR_OFFLINE_BACKUP_ONLINE"
    },
    {
      "timestamp": "2026-09-05T13:10:00+01:00",
      "sensorAOnline": false,
      "sensorBOnline": true,
      "state": "OFF",
      "reasonCode": "GRID_SENSOR_OFFLINE_BACKUP_ONLINE"
    },
    {
      "timestamp": "2026-09-05T13:15:00+01:00",
      "sensorAOnline": false,
      "sensorBOnline": true,
      "state": "OFF",
      "reasonCode": "GRID_SENSOR_OFFLINE_BACKUP_ONLINE"
    },
    {
      "timestamp": "2026-09-05T13:20:00+01:00",
      "sensorAOnline": false,
      "sensorBOnline": true,
      "state": "OFF",
      "reasonCode": "GRID_SENSOR_OFFLINE_BACKUP_ONLINE"
    },
    {
      "timestamp": "2026-09-05T13:25:00+01:00",
      "sensorAOnline": false,
      "sensorBOnline": true,
      "state": "OFF",
      "reasonCode": "GRID_SENSOR_OFFLINE_BACKUP_ONLINE"
    },
    {
      "timestamp": "2026-09-05T13:30:00+01:00",
      "sensorAOnline": false,
      "sensorBOnline": true,
      "state": "OFF",
      "reasonCode": "GRID_SENSOR_OFFLINE_BACKUP_ONLINE"
    },
    {
      "timestamp": "2026-09-05T13:35:00+01:00",
      "sensorAOnline": false,
      "sensorBOnline": true,
      "state": "OFF",
      "reasonCode": "GRID_SENSOR_OFFLINE_BACKUP_ONLINE"
    },
    {
      "timestamp": "2026-09-05T13:40:00+01:00",
      "sensorAOnline": false,
      "sensorBOnline": true,
      "state": "OFF",
      "reasonCode": "GRID_SENSOR_OFFLINE_BACKUP_ONLINE"
    },
    {
      "timestamp": "2026-09-05T13:45:00+01:00",
      "sensorAOnline": false,
      "sensorBOnline": true,
      "state": "OFF",
      "reasonCode": "GRID_SENSOR_OFFLINE_BACKUP_ONLINE"
    },
    {
      "timestamp": "2026-09-05T13:50:00+01:00",
      "sensorAOnline": false,
      "sensorBOnline": true,
      "state": "OFF",
      "reasonCode": "GRID_SENSOR_OFFLINE_BACKUP_ONLINE"
    },
    {
      "timestamp": "2026-09-05T13:55:00+01:00",
      "sensorAOnline": false,
      "sensorBOnline": true,
      "state": "OFF",
      "reasonCode": "GRID_SENSOR_OFFLINE_BACKUP_ONLINE"
    },
    {
      "timestamp": "2026-09-05T14:00:00+01:00",
      "sensorAOnline": true,
      "sensorBOnline": true,
      "state": "ON",
      "reasonCode": "GRID_SENSOR_REACHABLE"
    },
    {
      "timestamp": "2026-09-05T14:05:00+01:00",
      "sensorAOnline": true,
      "sensorBOnline": true,
      "state": "ON",
      "reasonCode": "GRID_SENSOR_REACHABLE"
    },
    {
      "timestamp": "2026-09-05T14:10:00+01:00",
      "sensorAOnline": true,
      "sensorBOnline": true,
      "state": "ON",
      "reasonCode": "GRID_SENSOR_REACHABLE"
    },
    {
      "timestamp": "2026-09-05T14:15:00+01:00",
      "sensorAOnline": true,
      "sensorBOnline": true,
      "state": "ON",
      "reasonCode": "GRID_SENSOR_REACHABLE"
    },
    {
      "timestamp": "2026-09-05T14:20:00+01:00",
      "sensorAOnline": true,
      "sensorBOnline": true,
      "state": "ON",
      "reasonCode": "GRID_SENSOR_REACHABLE"
    },
    {
      "timestamp": "2026-09-05T14:25:00+01:00",
      "sensorAOnline": true,
      "sensorBOnline": true,
      "state": "ON",
      "reasonCode": "GRID_SENSOR_REACHABLE"
    },
    {
      "timestamp": "2026-09-05T14:30:00+01:00",
      "sensorAOnline": true,
      "sensorBOnline": true,
      "state": "ON",
      "reasonCode": "GRID_SENSOR_REACHABLE"
    },
    {
      "timestamp": "2026-09-05T14:35:00+01:00",
      "sensorAOnline": true,
      "sensorBOnline": true,
      "state": "ON",
      "reasonCode": "GRID_SENSOR_REACHABLE"
    },
    {
      "timestamp": "2026-09-05T14:40:00+01:00",
      "sensorAOnline": true,
      "sensorBOnline": true,
      "state": "ON",
      "reasonCode": "GRID_SENSOR_REACHABLE"
    },
    {
      "timestamp": "2026-09-05T14:45:00+01:00",
      "sensorAOnline": true,
      "sensorBOnline": true,
      "state": "ON",
      "reasonCode": "GRID_SENSOR_REACHABLE"
    },
    {
      "timestamp": "2026-09-05T14:50:00+01:00",
      "sensorAOnline": true,
      "sensorBOnline": true,
      "state": "ON",
      "reasonCode": "GRID_SENSOR_REACHABLE"
    },
    {
      "timestamp": "2026-09-05T14:55:00+01:00",
      "sensorAOnline": true,
      "sensorBOnline": true,
      "state": "ON",
      "reasonCode": "GRID_SENSOR_REACHABLE"
    },
    {
      "timestamp": "2026-09-05T15:00:00+01:00",
      "sensorAOnline": true,
      "sensorBOnline": true,
      "state": "ON",
      "reasonCode": "GRID_SENSOR_REACHABLE"
    },
    {
      "timestamp": "2026-09-05T15:05:00+01:00",
      "sensorAOnline": true,
      "sensorBOnline": true,
      "state": "ON",
      "reasonCode": "GRID_SENSOR_REACHABLE"
    },
    {
      "timestamp": "2026-09-05T15:10:00+01:00",
      "sensorAOnline": true,
      "sensorBOnline": true,
      "state": "ON",
      "reasonCode": "GRID_SENSOR_REACHABLE"
    },
    {
      "timestamp": "2026-09-05T15:15:00+01:00",
      "sensorAOnline": true,
      "sensorBOnline": true,
      "state": "ON",
      "reasonCode": "GRID_SENSOR_REACHABLE"
    },
    {
      "timestamp": "2026-09-05T15:20:00+01:00",
      "sensorAOnline": true,
      "sensorBOnline": true,
      "state": "ON",
      "reasonCode": "GRID_SENSOR_REACHABLE"
    },
    {
      "timestamp": "2026-09-05T15:25:00+01:00",
      "sensorAOnline": true,
      "sensorBOnline": true,
      "state": "ON",
      "reasonCode": "GRID_SENSOR_REACHABLE"
    },
    {
      "timestamp": "2026-09-05T15:30:00+01:00",
      "sensorAOnline": true,
      "sensorBOnline": true,
      "state": "ON",
      "reasonCode": "GRID_SENSOR_REACHABLE"
    },
    {
      "timestamp": "2026-09-05T15:35:00+01:00",
      "sensorAOnline": true,
      "sensorBOnline": true,
      "state": "ON",
      "reasonCode": "GRID_SENSOR_REACHABLE"
    },
    {
      "timestamp": "2026-09-05T15:40:00+01:00",
      "sensorAOnline": true,
      "sensorBOnline": true,
      "state": "ON",
      "reasonCode": "GRID_SENSOR_REACHABLE"
    },
    {
      "timestamp": "2026-09-05T15:45:00+01:00",
      "sensorAOnline": true,
      "sensorBOnline": true,
      "state": "ON",
      "reasonCode": "GRID_SENSOR_REACHABLE"
    },
    {
      "timestamp": "2026-09-05T15:50:00+01:00",
      "sensorAOnline": true,
      "sensorBOnline": true,
      "state": "ON",
      "reasonCode": "GRID_SENSOR_REACHABLE"
    },
    {
      "timestamp": "2026-09-05T15:55:00+01:00",
      "sensorAOnline": true,
      "sensorBOnline": true,
      "state": "ON",
      "reasonCode": "GRID_SENSOR_REACHABLE"
    },